,headline,entity,majority_label
579,"Priorities USA, Democratic Super PAC, Will Spend $150 Million on Anti-Trump Ads",Trump,Negative
580,A Step-by-Step Guide to Trump’s Impeachment Trial,Trump,Negative
581,Trump’s Impeachment Team Takes Shape as Trial Looms,Trump,Neutral
582,Elizabeth Warren Says Bernie Sanders Sent Volunteers ‘Out to Trash Me’,Sanders,Negative
583,"Local New Hampshire Union Backs Bernie Sanders, Bucking National Affiliate",Sanders,Positive
584,Michael Bloomberg Is Open to Spending $1 Billion to Defeat Trump,Trump,Neutral
585,Seven Days in January: How Trump Pushed U.S. and Iran to the Brink of War,Trump,Negative
586,Sanders and Biden Look for Dominance in Early States,Biden,Positive
587,He Was Cruising in a G.O.P. Primary. Then Trump Endorsed an Ex-Democrat.,Trump,Neutral
588,Elizabeth Warren Opens a New Front in Disability Policy,Warren,Positive
589,Tom Steyer Qualifies for Democratic Debate With Two Surprising Polls,Steyer,Positive
590,"At First Rally of Election Year, Trump Boasts About Strike on Iranian General",Trump,Neutral
591,"Army Denies Request by Soldier Pardoned by Trump, Setting Up Showdown",Trump,Neutral
592,Around the Country in 17 Hours With Michael Bloomberg,Bloomberg,Neutral
593,Bernie Sanders and Elizabeth Warren Jointly Urge Against War With Iran,Sanders,Neutral
594,Bernie Sanders and Elizabeth Warren Jointly Urge Against War With Iran,Warren,Neutral
595,How Elizabeth Warren Is Being Squeezed by 2 Democratic Factions,Warren,Neutral
596,Full Transcript: President Trump’s Address on Iran,Trump,Neutral
597,A Strategy for the Mideast That Has Even Trump’s Allies Scratching Their Heads,Trump,Negative
598,How a Misleading Biden Video Spread,Biden,Negative
599,Trump Falsely Claims That Ukraine Aid Arrived ‘Ahead of Schedule’,Trump,Negative
600,Bloomberg and Trump Buy Super Bowl Ads at $10 Million Each,Trump,Neutral
601,Elizabeth Warren’s Bankruptcy Plan Revives Old Clash With Biden,Warren,Neutral
602,"Pentagon Rules Out Striking Iranian Cultural Sites, Contradicting Trump",Trump,Neutral
603,"Bolton Is Willing to Testify in Trump Impeachment Trial, Raising Pressure for Witnesses",Trump,Neutral
604,Biden and Sanders Differ on Foreign Policy. They’re Happy to Tell You So.,Sanders,Neutral
605,"Trump Threatens Iranian Cultural Sites, and Warns of Sanctions on Iraq",Trump,Negative
606,"Phil Roe, Tennessee Republican, Announces Retirement From Congress",Republicans,Negative
607,Pete Buttigieg and the One Percent,Buttigieg,Neutral
608,Biden Warns About Disinformation After Misleading Video,Biden,Negative
609,Cash-Rich Democrats Brace for Long Fight as Trump Hoards Money,Democrats,Positive
610,Cash-Rich Democrats Brace for Long Fight as Trump Hoards Money,Trump,Negative
611,Christianity Today Editor Laments ‘Ethical Naïveté’ of Trump Backers,Trump,Negative
612,Joe Biden Says He Raised $22.7 Million in the Fourth Quarter,Biden,Positive
613,"Andrew Yang Raised $16.5 Million in the Last 3 Months, His Campaign Says",Yang,Positive
614,Trump Bet He Could Isolate Iran and Charm North Korea. It’s Not That Easy.,Trump,Negative
615,Dizzying Day for Trump Caps a Year Full of Them,Trump,Neutral
616,Firings at Trump Property Cap Year of Purging Undocumented Workers,Trump,Negative
617,Trump Warns Iran as Risk of Wider Armed Conflict Grows,Trump,Neutral
618,2nd Senate Republican Questions Impartiality of Impeachment Trial,Republicans,Neutral
619,Judge Dismisses Lawsuit by Ex-Trump Aide Subpoenaed in Impeachment Inquiry,Trump,Positive
620,"Biden Rebounds, Warren Slows, Sanders Rolls: The Latest on the 2020 Money Race",Warren,Negative
621,"As Trump Hails Stock Market, Democrats Point to Struggling Workers",Democrats,Positive
622,"As Trump Hails Stock Market, Democrats Point to Struggling Workers",Trump,Neutral
623,Inside the Biggest 2020 Advertising War Against Trump,Trump,Negative
624,‘Nothing Less Than a Civil War’: These White Voters on the Far Right See Doom Without Trump,Trump,Negative
625,Joe Biden Says He’d Defy Subpoena to Testify in Trump’s Senate Trial,Biden,Negative
626,Congress Wants to Force Trump’s Hand on Human Rights in China and Beyond,Trump,Negative
627,Why Bernie Sanders Is Tough to Beat,Sanders,Positive
628,A Barrier to Trump’s Border Wall: Landowners in Texas,Trump,Negative
629,The ‘But I Would Vote for Joe Biden’ Republicans,Republicans,Neutral
630,"For Trump Organization, Office Skyscrapers Make Up for Lagging Hotels",Trump,Negative
631,Bloomberg Drops Vendor Connected to Prison Labor,Bloomberg,Neutral
632,Christian Post Editor Resigns Over Editorial Defending Trump,Trump,Neutral
633,"Elizabeth Warren Returns to Oklahoma, Stressing Working-Class Roots",Warren,Neutral
634,Durham Surprises Even Allies With Statement on F.B.I.’s Trump Case,Trump,Negative
635,Officials Discussed Hold on Ukraine Aid After Trump Spoke With Country’s Leader,Trump,Neutral
636,Trump Largely Ignores Impeachment as He Rallies Young Conservatives,Trump,Negative
637,A Law Professor’s Provocative Argument: Trump Has Not Yet Been Impeached,Trump,Neutral
638,Trump Has a Habit of Quoting His Allies on Twitter Saying Things They Never Said,Trump,Negative
639,Evangelical Leaders Close Ranks With Trump After Scathing Editorial,Trump,Negative
640,Christianity Today’s Editorial on Trump: 5 of Its Sharpest Rebukes,Trump,Negative
641,The 2020 Democrats Were Told to Give a Gift or Ask Forgiveness. Guess What the Women Chose.,Democrats,Neutral
642,Buttigieg and Warren Clash Over ‘Wine Cave’ Fund-Raiser,Warren,Neutral
643,Watch Andrew Yang Talk About Racial Representation at Democratic Debate,Yang,Neutral
644,Evangelical Magazine Christianity Today Calls for Trump’s Removal,Trump,Negative
645,"Jeff Van Drew Switches Parties, Pledging ‘Undying Support’ for Trump",Trump,Positive
646,Trump Ally Mark Meadows Will Not Seek Re-election,Trump,Neutral
647,Trump Was Impeached. Here’s a Recap of the Day.,Trump,Negative
648,Trump Impeachment: Three Democrats Cross Party Lines to Vote ‘No’,Democrats,Negative
649,Trump Impeachment: Three Democrats Cross Party Lines to Vote ‘No’,Trump,Positive
650,"Joe Biden Is Sounding Like a Pundit, and He’s Bullish on a Certain Former V.P.",Biden,Negative
651,Sanders and Buttigieg in tight race for delegates,Sanders,Neutral
652,Iowa Democratic Party chairman steps down following caucus flub,Democratic Party,Negative
653,Trump budget proposal draws partisan ire,Trump,Negative
654,"MSNBC anchors tout Warren as 'really, really, really good candidate' after 4th-place New Hampshire finish",Warren,Positive
655,Deroy Murdock: Iowa was disaster in Democratic Party's meltdown,Democratic Party,Negative
656,Sanders campaign on support from DNC,Sanders,Positive
657,Media spotlight surging Klobuchar as Sanders leads in NH,Klobuchar,Positive
658,Media spotlight surging Klobuchar as Sanders leads in NH,Sanders,Positive
659,MSNBC's Chuck Todd says he doesn't understand how Bernie Sanders is 'considered a front-runner',Sanders,Negative
660,Roger Stone juror's anti-Trump social media posts surface after she defends DOJ prosecutors,Trump,Negative
661,Tulsi Gabbard refuses to quit despite media attacks,Gabbard,Neutral
662,Chris Wallace on Attorney General Bill Barr's plea to President Trump,Trump,Neutral
663,Biden badly wounded as the press wonders who can beat Bernie,Biden,Negative
664,Tammy Bruce: Why February 2020 will be known as the month when Trump was reelected,Trump,Positive
665,Adriana Cohen: Elizabeth Warren's 2020 bid is collapsing and the reason might surprise you,Warren,Negative
666,Chris Wallace: Bill Barr throws a brushback pitch at President Trump,Trump,Neutral
667,President Trump responds to Attorney General Barr's headline-making interview,Trump,Neutral
668,Moderate Democrats fear Bernie Sanders could hurt party's chances to keep control of the House,Sanders,Negative
669,"Trump insists he has ‘legal right’ to intervene in DOJ cases, but has chosen not to",Trump,Neutral
670,"Lara Trump reacts to Jill, Joe Biden defending son Hunter on ‘The View’",Biden,Neutral
671,Biden turns to Wall Street for campaign funds,Biden,Neutral
672,Tammy Bruce: February 2020 will be known as the month when President Trump was reelected,Trump,Positive
673,Some House Democrats worry Bernie Sanders could cost them re-election,Sanders,Negative
674,"Biden faces NYC protesters chanting ‘Drop out, Joe!’",Biden,Negative
675,Sen. Blackburn reacts to Bloomberg campaign stop in Tennessee,Bloomberg,Neutral
676,Barr says Trump tweets make it 'impossible' to run DOJ,Trump,Negative
677,2020 Democrats battle it out to court black voters,Democrats,Negative
678,Biden panders to black voters in new ad: I don't feel no ways tired,Biden,Negative
679,Guy Benson on Democratic establishment and Bernie Sanders,Sanders,Neutral
680,Bloomberg and Trump clash as questions surround how NYC mayor will fare in 2020 race,Trump,Negative
681,Democrats divided over possible Bernie Sanders nomination,Sanders,Neutral
682,White House responds to Attorney General Barr's concerns with Trump tweets,Trump,Negative
683,Mike Bloomberg says he's willing to spend whatever it takes to beat President Trump,Trump,Negative
684,Bill Barr draws Democrats' ire over Roger Stone case,Democrats,Neutral
685,Poll: African-American support for Biden plummeting,Biden,Negative
686,John Delaney: Bernie doesn't have the right message to attract wide range of voters,Delaney,Neutral
687,Trump administration warns Chinese government can spy on user data,Trump,Neutral
688,New York State Sues Trump Administration Over Global Entry Ban,Trump,Negative
689,Trump’s NASA Budget Will Earmark 12% Boost for Agency in 2021,Trump,Neutral
690,Trump Announces Coronavirus Task Force,Trump,Neutral
691,Veterans Differ With Trump Over Injuries From Iran Missile Attack,Trump,Neutral
692,Trump Says He Will Sign Phase-One Trade Deal With China on Jan. 15,Trump,Neutral
693,"In Virginia, Democrats Get Ready to Rule the Roost",Democrats,Positive
694,Trump to Hold Off Designating Mexican Cartels as Terrorist Groups,Trump,Neutral
695,"Trump Administration Considers 14,000 More Troops for Mideast",Trump,Neutral
696,Trump Administration Asks Supreme Court to Reinstate Blocked Executions,Trump,Neutral
697,"A Tight Job Market Insulates a Slowing Economy-and Perhaps Trump, Too",Trump,Negative
698,"Florida man who drove van into GOP tent didn’t like Trump, says ‘someone had to take a stand’: arrest report",Trump,Neutral
699,"PAYBACK: Trump Wrecks U.S. Attorney Who Indicted Stone, Manafort, Flynn",Trump,Negative
700,Bernie Sanders doesn’t see a future for pro-lifers in the Democratic Party: 'Being pro-choice is an absolutely essential part of being a Democrat' (VIDEO) - True Pundit,Sanders,Neutral
701,DOJ Has ‘Established An Intake Process’ To Review Biden-Ukraine Info From Giuliani,Biden,Negative
702,Gov. Newsom Calls California ‘the Most Un-Trump State in America’ (VIDEO),Trump,Negative
703,"Asked Who’d Be Her V.P., Warren Sneers That Pence Is A ‘Dog’",Warren,Neutral
704,Report: Trump Administration Has Removed 70 Obama Holdovers at NSC,Trump,Neutral
705,"FBI probing Joe, Hunter Biden corruption? ‘We do not talk about open investigations’ (VIDEO)",Biden,Negative
706,Florida man accused of driving van into Trump-supporters' tent reportedly smiles while entering court,Trump,Negative
707,WATCH: Warren Suggests Blacks Only Matter To Democrats During Elections,Warren,Negative
708,Republicans raise $117 million throughout Trump’s impeachment,Trump,Positive
709,Pete Buttigieg Argues for End of Electoral College After Iowa ‘Victory’ Without Popular Vote,Buttigieg,Neutral
710,"Sanders once said he didn't mind being called 'a communist,' was investigated by FBI",Sanders,Neutral
711,GOP candidate Kimberly Klacik believes she can flip Elijah Cummings' Baltimore district,GOP,Positive
712,Rudy Giuliani Claims He’s Found ‘Smoking Gun’ On Hunter Biden,Biden,Negative
713,"Republicans To EXPUNGE Democrats’ Impeachment Of Trump If They Win House Back, Report Says",Republicans,Positive
714,"Republicans To EXPUNGE Democrats’ Impeachment Of Trump If They Win House Back, Report Says",Trump,Positive
715,Biden bus breaks down in New Hampshire,Biden,Neutral
716,"WATCH: Joe Biden Loses It Attacks ""Dog Faced"" Female Voter in Bizarre & Beyond Disturbing Rant",Biden,Negative
717,Sanders: The United States Is a ‘Racist Society’ (VIDEO),Sanders,Negative
718,"'It was all bulls**t': Trump hits Romney, Democrats, and Russia probe in post-acquittal victory speech (VIDEO)",Democrats,Negative
719,WATCH: Chris Matthews Compares GOP Applause During SOTU to North Koreans Praising Dear Leader,GOP,Negative
720,"A really good week for President Trump keeps getting better: 225,000 jobs added in January, crushing estimates",Trump,Positive
721,"Joy Behar, Furious Over Acquittal, Says Trump’s ‘Winning’: ‘He’s Made Me Crazy!’ (VIDEO)",Trump,Negative
722,WATCH: Joe Biden stops Democratic debate to ask audience to stand and applaud for impeachment witness fired by Trump,Biden,Positive
723,"Trump Continues To Clean House, Fires Ambassador Gordon Sondland",Trump,Neutral
724,POLL: 62% of NH Dems prefer meteor strike ‘extinguishing all human life’ to Trump re-election!,Trump,Negative
725,Pete Buttigieg Refuses to Answer Half of NYT Foreign Policy Survey,Buttigieg,Negative
726,"WATCH: Bernie, Buttigieg, Biden Lash Out At Trump For Killing Top Terrorist Soleimani",Biden,Neutral
727,MAYOR CHEAT Buttigieg campaign roasted for adding applause sound track to CNN town hall clips,Buttigieg,Negative
728,Trump Administration Looking To Take Action Against Alexander Vindman,Trump,Neutral
729,‘A little sedated’: Pelosi speculates Trump was drugged during SOTU,Trump,Negative
730,FLASHBACK: Top Romney Advisor Served On Burisma’s Board With Hunter Biden,Biden,Neutral
731,Tired of Winning? Donald Trump Breaks Obama Approval Record,Trump,Positive
732,"WATCH: Pence Shreds Pelosi For Ripping Up Trump’s SOTU Speech, Makes Prediction",Trump,Positive
733,Reporter Presses Pelosi About Ripping Up Trump’s Speech. Here’s Her Harsh Response.,Trump,Negative
734,Republican Kevin McCarthy Rips Up Articles Of Impeachment: ‘Acquitted For Life’ (VIDEO),Republicans,Neutral
735,IOWA RESULTS: Buttigieg (Kind of) Won. So Did Bernie. Warren Persisted. Biden Definitely Lost.,Biden,Positive
736,"MSNBC Anchor Says Netanyahu is One of the World’s ‘Bad Guys,’ Puts Jewish Leader in List With Putin (VIDEO)",Putin,Negative
737,GOP Senators Take New Action In Investigating Hunter Biden After Impeachment Vote,Biden,Negative
738,WATCH: Warren Runs And Hides Behind Staffer After Being Caught Flying Private Plane,Warren,Negative
739,WATCH: Biden blames Trump surrogates for botched Iowa caucus count,Trump,Negative
740,Biden Threatens Lawsuit To Halt Release Of Real Iowa Caucus Results,Biden,Negative
741,WATCH: Trump Won’t Shake Nancy Pelosi’s Hand at State of the Union,Trump,Negative
742,"WATCH: Democrats Refuse To Celebrate Economic Success For Blacks, Latinos, Women, Asians",Democrats,Negative
743,WATCH: Melania Trump Awards Rush Limbaugh Presidential Medal Of Freedom At Trump State Of The Union Address,Trump,Neutral
744,"Trump's job approval rating rises to 49 percent amid impeachment, highest since taking office, Gallup says",Trump,Positive
745,WATCH: Pelosi Violates Protocol By Refusing To Announce Trump Properly at SOTU Rips Up Speech,Trump,Negative
746,John Kerry Endorses Biden to Fight Against ‘AR-16 with Long Clip’,Biden,Positive
747,Buttigieg: 63 Million People Might Have Voted for Trump But All of Them Are Still Racist (VIDEO),Trump,Negative
748,"Trump, in Super Bowl interview with Sean Hannity, predicts fall of Pelosi: 'Radical left is gonna take over'",Trump,Neutral
749,Rep. Hakeem Jeffries Slams Trump’s Overtures to Ukraine: ‘America’s National Security is for Sale’ (VIDEO),Trump,Negative
750,"Joe Biden Helped Launch Business for Son-in-Law from the Oval Office, Repeatedly Briefed Investors Privately",Biden,Negative
751,Jill Biden: Donald Trump’s Attacks on My Kid Are ‘Disgraceful’,Biden,Negative
752,Steve Hilton: Why is Trump hounded while Biden's alleged corruption gets a pass? The 'Swamp' knows,Trump,Positive
753,Florida considering a ban on sex-change surgeries for children Democrats opposed,Democrats,Neutral
754,"Rand Paul urges Trump to take immediate action against John Bolton, revoke his security clearance",Trump,Neutral
755,Washington Democrats Push Mandatory LGBTQ-Focused Sex Ed for Kindergartners,Democrats,Negative
756,"DNC Members Discuss Changing Rules To Stop Sanders From Getting Nomination At Convention, Report Says",Sanders,Negative
757,House Democrats: Steele Dossier Was OK Because We ‘Purchased’ It,Democrats,Negative
758,"Senate Votes Down Extra Impeachment Witnesses, Paves Way for Trump Acquittal",Trump,Positive
759,Trump Takes Out Another Top Terrorist In The Middle East,Trump,Neutral
760,GOP Opponent to Jeff Van Drew Avoids Primary Against the Dem-Turned-Republican by Switching Districts,Republicans,Neutral
761,Dave Chappelle: 'I don’t look at Trump supporters as my enemy' (VIDEO),Trump,Neutral
762,"MSNBC Contributor: If Trump Is Acquitted, He Will Shut Down Voting in California (VIDEO)",Trump,Negative
763,"Trump Unveils Super Bowl Ad Touting US Economy: ‘Stronger, Safer, More Prosperous’ (VIDEO)",Trump,Positive
764,Elizabeth Warren Made Millions Helping Corporations Evade Their Pension and Healthcare Obligations,Warren,Negative
765,Report: The Ukraine Prosecutor Biden Got Fired Files Federal Paperwork Demanding Investigation Into Biden,Biden,Negative
766,Kevin McCarthy Sets All-Time Annual Fundraising Record as GOP Embarks on Effort to Retake House Majority,GOP,Positive
767,Alec Baldwin: Trump’s Impeachment Centers on a Hate Crime. He Hates the Constitution’,Trump,Negative
768,"Bloomberg: Transgender Rights Should Include Federally Funded Sex Surgery, Housing Based on Gender Identity",Bloomberg,Neutral
769,"CONFUSION: Biden says ‘got elected in 2012, 2010 or 13’ (VIDEO)",Biden,Negative
770,Warren Can’t Name Any GOP Senate Colleagues With Character (VIDEO),Warren,Neutral
771,Schiff Claims It’s Wrong for President to Investigate Rival - After Defending Obama Investigating Trump,Trump,Negative
772,WATCH: CNN’s Don Lemon Responds to Criticism of Him Laughing at Joke About Trump Supporters,Trump,Neutral
773,Chris Murphy: It’s ‘Possible’ Some Democrats Vote to Acquit Trump,Trump,Positive
774,"EXCLUSIVE: FEDS Leak Explosive Details of Players in Massive Clinton Global Heist Biden's Implicated in ""Organized crime at the highest level""",Biden,Negative
775,"Republican Senator Reportedly Mulling a Witness Swap, ‘One for One’ Deal in Impeachment Inquiry",Republicans,Negative
776,Pelosi: House Will Vote on Repealing Trump Travel Ban,Trump,Negative
777,Trump Doesn’t Invite House Democrats to USMCA Signing Ceremony,Trump,Neutral
778,Sanders Campaign Rocked Again: More Staff Caught Advocating Violence Against Opponents (VIDEO),Sanders,Negative
779,BIDEN GETS TOUGH: Trump ‘going to understand what punches mean’ (VIDEO),Trump,Negative
780,Joe Biden Says Transgender Equality is the Civil Rights Issue of Our Time,Biden,Positive
781,Biden Praises ‘Profound’ Question Comparing Trump’s Border Policies to Holocaust (VIDEO),Trump,Negative
782,WATCH: Harvard Law Professor Dismantles Democrats’ Hopes Of Using Bolton Book To Convict Trump,Trump,Neutral
783,"WATCH: CNN Mocks Trump Supporters As Stupid Rednecks Who Can’t Read, Spell",Trump,Negative
784,MLK’s Niece Denounces Democrat For ‘Race Baiting’ Trump,Trump,Negative
785,"Amid impeachment, Trump's approval rating climbs to highest levels of his presidency",Trump,Positive
786,"Trump Says Lead Impeachment Democrat Schiff Has Not Paid ‘Price, Yet’",Trump,Negative
787,"MSNBC: Schiff, impeachment managers mentioned Biden 168 times - in just one day (VIDEO)",Biden,Neutral
788,Twitter Attaches Warning to Trump Campaign’s Pro-Life Video,Trump,Negative
789,Tom Cotton Defends Trump’s Decision to Fire Ukrainian Ambassador: ‘Badmouthing’ Is a Good Reason to Fire Her (VIDEO),Trump,Neutral
790,WATCH: George Stephanopoulos Makes Throat-Slitting Gesture to Cut Away from Trump Lawyer,Trump,Negative
791,"Rudy Giuliani: ‘Joe Biden Is a Crook’ - ‘If We Can’t Prosecute Him, We Do Not Have Justice in America’",Biden,Negative
792,"Adam Schiff: Remove Trump, Because He Didn’t Follow Talking Points",Trump,Negative
793,Joe Biden: ‘We Don’t Need Standing Armies’ ‘We Should Be Helping’ Communist China (VIDEO),Biden,Neutral
794,Steve Mnuchin Says He Will Listen to Greta Thunberg After She Gets an Economics Degree in College,Thunberg,Neutral
795,"Schiff claims that if President Trump is not removed from office by impeachment, Americans can't trust the results of the 2020 election (VIDEO)",Trump,Negative
796,"WATCH: Joe Biden Loses It Again -- Says Illegal Aliens Are ""More American"" Than You",Biden,Negative
797,Elizabeth Warren pledges to fill at least half her Cabinet with women and 'non binary people',Warren,Neutral
798,Pentagon to divert $3.8 billion from its budget to build more of Trump’s border barrier,Trump,Neutral
799,Barr keeps giving Trump what he wanted,Trump,Positive
800,"Bernie Sanders is powered by a loyal base, but results in Iowa and New Hampshire show the movement has limits",Sanders,Positive
801,"In a tweet, Trump again appears to leverage his office for his personal benefit",Trump,Negative
802,"Joe and Jill Biden say attacks on Hunter are ""hurtful""",Biden,Neutral
803,Trump suggests Roger Stone’s jury forewoman had ‘significant bias’,Trump,Neutral
804,"On social media, Bloomberg and Trump are fighting two very different fights",Bloomberg,Neutral
805,Septuagenarians Trump and Bloomberg exchange middle-school-like taunts,Bloomberg,Neutral
806,Septuagenarians Trump and Bloomberg exchange middle-school-like taunts,Trump,Negative
807,The challenge of Joe Biden’s message to black voters holding,Biden,Neutral
808,Trump seeks to bend the executive branch as part of impeachment vendetta,Trump,Negative
809,Warren strategizes on how to move ahead after tough finishes,Warren,Neutral
810,The Democratic Party’s delegate math is about to get very complicated — and potentially problematic - The Washington Post,Democratic Party,Negative
811,"For Klobuchar and Warren, the 2020 primary is an endurance race",Klobuchar,Neutral
812,"For Klobuchar and Warren, the 2020 primary is an endurance race",Warren,Neutral
813,"In 2016, Trump constantly alleged that the Clintons improperly influenced the attorney general",Trump,Neutral
814,The Energy 202: Climate concerns help boost Sanders and Buttigieg in New Hampshire primary,Buttigieg,Positive
815,The Energy 202: Climate concerns help boost Sanders and Buttigieg in New Hampshire primary,Sanders,Positive
816,Trump withdraws Treasury nomination of former U.S. attorney for D.C. Jessie K. Liu after criticism of her oversight of Mueller prosecutions,Trump,Neutral
817,Joe Biden’s track record of lousy primary finishes just got a bit longer,Biden,Negative
818,New Hampshire Democrats make up their minds at the last possible minute - The Washington Post,Democrats,Neutral
819,"Elizabeth Warren Democratic candidate: Biography, issues, fundraising",Warren,Neutral
820,Amy Klobuchar,Klobuchar,UNK
821,Romney suggests Senate GOP has moved on following his vote to convict Trump,Trump,Negative
822,"Joe Biden Democratic candidate: Biography, issues, fundraising",Biden,Neutral
823,Trump isn’t worried about beating Republicans in the primaries. He wants to beat the Democrats. - The Washington Post,Democrats,Neutral
824,Trump isn’t worried about beating Republicans in the primaries. He wants to beat the Democrats.,Trump,Neutral
825,The Technology 202: 2020 Democrats get personal in Facebook ads ahead of New Hampshire primary - The Washington Post,Democrats,Neutral
826,Trump and Democratic candidates struggle to rally behind budget vision as 2020 election nears,Trump,Neutral
827,"Trump barges in on Democratic primary races, seeking to steal the spotlight",Trump,Negative
828,Klobuchar gets a moment — and hopes she can make it last,Klobuchar,Neutral
829,"As Buttigieg rises, so does the question of what it means to be mayor of a midsize city ",Buttigieg,Positive
830,Billionaires Bloomberg and Steyer may be accelerating a Biden collapse,Biden,Negative
831,Billionaires Bloomberg and Steyer may be accelerating a Biden collapse,Steyer,Neutral
832,"The Technology 202: Democrats call for Facebook, Twitter to take down edited Nancy Pelosi video - The Washington Post",Democrats,Negative
833,"Iowa Democratic Party projects Pete Buttigieg the winner of the delegate race, with Bernie Sanders preparing a challenge - The Washington Post",Democratic Party,Positive
834,"Top Democrats turn on each other after Iowa, complicating the party’s chances against Trump - The Washington Post",Democrats,Negative
835,"Top Democrats turn on each other after Iowa, complicating the party’s chances against Trump",Trump,Positive
836,Sanders and Buttigieg fight for different New Hampshire voters.,Buttigieg,Neutral
837,"Buttigieg responds to Biden’s Obama jab: ‘I’m not, and neither is he’",Biden,Neutral
838,"Buttigieg, Biden, Klobuchar, fight as New Hampshire primary nears",Buttigieg,Negative
839,"Buttigieg, Biden, Klobuchar, fight as New Hampshire primary nears",Klobuchar,Neutral
840,"Trump fires Gordon Sondland, the second impeachment witness to be removed from his post Friday",Trump,Negative
841,Trump hasn’t offered any reason beyond the obvious for punishing Alexander Vindman,Trump,Negative
842,"What ’shattered the mentality of American decline’, as Trump put it in his State of the Union? Partisan shifts, for one.",Trump,Neutral
