,headline,entity,majority_label
1082,Trump rips Democrats on eve of likely impeachment - The Washington Post,Democrats,Negative
1083,Federal agencies will be closed Dec. 24 as Trump issues executive order,Trump,Neutral
1084,Mitt Romney and Susan Collins sound reluctant to rock the GOP boat on impeachment - The Washington Post,GOP,Neutral
1085,"Power Up: Almost 2 in 3 Republicans want Trump to allow top aides to testify at Senate trial, new Post-ABC poll finds - The Washington Post",Republicans,Positive
1086,"Power Up: Almost 2 in 3 Republicans want Trump to allow top aides to testify at Senate trial, new Post-ABC poll finds",Trump,Neutral
1087,"Democrats accuse Trump of criminal bribery, wire fraud in report that explains articles of impeachment - The Washington Post",Democrats,Neutral
1088,Partisanship is helping Trump in the impeachment fight more than it’s hurting him,Trump,Positive
1089,Jeff Van Drew’s party switch underscores the particularly partisan impeachment of Trump,Trump,Negative
1090,"President Trump has made 15,413 false or misleading claims over 1,055 days",Trump,Negative
1091,"Schumer calls for testimony from Mulvaney, Bolton in proposal to GOP on parameters for Trump impeachment trial",Trump,Negative
1092,The Trailer: Andrew Yang's increasingly normal campaign,Yang,Neutral
1093,Mike Bloomberg has spread his money to liberal activist groups for years and now is spending more on his own campaign,Bloomberg,Neutral
1094,House set for historic floor vote next week after committee approves two articles of impeachment against Trump,Trump,Negative
1095,Trump promised Zelensky a White House meeting. More than a dozen other leaders got one instead.,Trump,Negative
1096,"Buttigieg takes aim at ""purity tests""",Buttigieg,Neutral
1097,"Warren, Sanders, Biden, Yang, Klobuchar, Steyer, Buttigieg may skip next debate over Loyola Marymount labor dispute ",Sanders,Neutral
1098,"Warren, Sanders, Biden, Yang, Klobuchar, Steyer, Buttigieg may skip next debate over Loyola Marymount labor dispute ",Steyer,Neutral
1099,"Warren, Sanders, Biden, Yang, Klobuchar, Steyer, Buttigieg may skip next debate over Loyola Marymount labor dispute ",Warren,Negative
1100,"Trump has described the same conversation about Israel four times. Each time, the name of his Jewish friend changed.",Trump,Negative
1101,How Trump’s Senate impeachment trial might work,Trump,Negative
1102,How the House Judiciary vote on Trump impeachment compares to past votes,Trump,Neutral
1103,"Trump?s FBI slurs endanger agents, former employee says",Trump,Negative
1104,Trump casts criticism of Israel as dangerous as he courts Jewish voters for 2020,Trump,Negative
1105,"Matt Bevin, GOP Kentucky governor, pardoned violent criminals following election loss to Andy Beshear - The Washington Post",GOP,Negative
1106,"Reps. Matt Gaetz, Hank Johnson spar over Hunter Biden addiction comments",Biden,Neutral
1107,House impeachment vote whip count: Where Democrats and Republicans stand - Washington Post,Democrats,Neutral
1108,Trump’s top trade official meets with GOP senators to soothe tensions over final USMCA deal,Trump,Neutral
1109,One sign that Trump is worried about impeachment? His avalanche of tweets.,Trump,Negative
1110,Donald Trump Jr. shot and killed an endangered sheep in Mongolia without a permit,Trump,Negative
1111,The Finance 202: Powell is propping up Trump's economy,Trump,Negative
1112,Ex-Trump employees share stage with Biden to blast their former boss,Trump,Negative
1113,House Democrats brace for some defections among moderates on impeachment of Trump - The Washington Post,Democrats,Neutral
1114,House Democrats brace for some defections among moderates on impeachment of Trump,Trump,Neutral
1115,Senate Republicans look to hold short impeachment trial despite Trump’s desire for an aggressive defense - The Washington Post,Republicans,Neutral
1116,Biden holds a big lead over Trump with a key demographic: Cynics,Biden,Positive
1117,Biden holds a big lead over Trump with a key demographic: Cynics,Trump,Neutral
1118,Michael Horowitz just shot down a bunch of Trump conspiracy theories,Trump,Neutral
1119,Some Democrats worry anti-corporate purity test go too far - The Washington Post,Democrats,Negative
1120,"House asks Supreme Court not to delay access to Trump’s financial records, citing threat to 2020 elections",Trump,Negative
1121,The Daily 202: Trump welcoming Russia’s top diplomat back to the Oval Office is one of his most brazen moves yet,Trump,Negative
1122,Power Up: Trump's roller-coaster Tuesday is emblematic of his presidency,Trump,Negative
1123,House Democrats unveil two articles of impeachment against Trump White House predicts ‘full exoneration’ in GOP-led Senate - The Washington Post,GOP,Neutral
1124,"Democrats charge Trump with two impeachment articles, setting up historic vote - The Washington Post",Democrats,Positive
1125,"Democrats charge Trump with two impeachment articles, setting up historic vote",Trump,Negative
1126,Trump lashes out at FBI director in wake of Justice Department inspector general’s report,Trump,Negative
1127,"Under pressure, Buttigieg releases names of former McKinsey clients",Buttigieg,Negative
1128,The Trailer: What Nevada could mean for Bernie Sanders,Sanders,Neutral
1129,House Democrats say Trump is unfit for office but eagerly deal with him on trade,Trump,Neutral
1130,Trump’s already running the race he wants: Against an opponent as unpopular as he is,Trump,Neutral
1131,Giuliani says Trump asked him to brief Justice Dept. and GOP senators on his Ukraine findings,Trump,Neutral
1132,Trump?s moves to salvage North Korea nuclear talks amid threats from Pyongyang draw rebukes from Bolton and Biden,Biden,Neutral
1133,Trump?s moves to salvage North Korea nuclear talks amid threats from Pyongyang draw rebukes from Bolton and Biden,Trump,Negative
1134,Mike Bloomberg’s 5 percent support in primary is a positive sign for his campaign,Bloomberg,Positive
1135,Democrats ditch ‘bribery’ and Mueller in Trump impeachment articles. But is that the smart play?,Trump,Neutral
1136,"Christopher Wray, basically: Don’t listen to Trump’s Ukraine conspiracy theories",Trump,Neutral
1137,The Energy 202: These Republicans want to show they're serious about climate change. So they put on a showcase. - The Washington Post,Republicans,Positive
1138,"Democrats expected to unveil articles of impeachment against Trump, focusing on abuse of power, obstruction of Congress",Trump,Negative
1139,Attorney General William Barr reschedules his holiday party at the Trump hotel,Trump,Neutral
1140,"Trump’s Russia-probe defense, led by Barr, is already moving on from Horowitz",Trump,Positive
1141,Democrats question McConnell’s decision to return Senate to business - The Washington Post,Democrats,Neutral
1142,GOP official says Republican senators not getting enough credits for covid-19 aid - The Washington Post,Republicans,Positive
1143,"Dan Crenshaw Rips Democrats’ ‘Cowardice,’ Says Congress ‘Must Come Out Of Hiding’",Democrats,Negative
1144,A Top Republican Senator Is Pushing One of the Biggest Jobs Programs in History,Republicans,Positive
1145,Senate Republicans want federal government to play bigger role in coronavirus testing - The Washington Post,Republicans,Positive
1146,Pelosi Claims GOP Stalled PPP Funding. She Praised Democrats For Blocking It.,Democrats,Positive
1147,Here We Go: Democrats Equate Halting WHO Funding To ‘Impeachable’ Offenses,Democrats,Negative
1148,Donald Trump: Democrats Must End ‘Endless Vacation’ and Get Back to Work,Democrats,Negative
1149,WATCH: Nancy Pelosi Congratulates Senate Democrats For Stalling $250 Billion Small Business Aid Program,Democrats,Negative
1150,Ted Cruz Just Obliterated Obama’s Claim That Republicans Have A ‘Propaganda Network’,Republicans,Positive
1151,Democrats push for illegal immigrants to get coronavirus stimulus cash,Democrats,Negative
1152,GOP Mulls Options to Oppose ‘Partisan’ Pelosi Oversight Committee,GOP,Negative
1153,Biden campaign’s selection of preferred super PAC stokes strife in Democratic Party - The Washington Post,Democratic Party,Negative
1154,"CARVILLE: Republicans ‘Will Kill People To Stay In Power, Literally’",Republicans,Negative
1155,Dem Senators: GOP Small Business Aid Is ‘Political Stunt’ (VIDEO),GOP,Negative
1156,Trump Fires Intelligence Community Watchdog Who Helped Launch Democrats Impeachment Inquiry,Democrats,Negative
1157,Democrats Demand DOJ ‘Release As Many Prisoners As Possible’ Over Coronavirus,Democrats,Negative
1158,"Biden earns slew of new endorsements, from former challengers to ‘Never Trump’ Republicans - The Washington Post",Republicans,Neutral
1159,WATCH: Kennedy Says Democrats Blocking Stimulus Decided to ‘Double Down on Stupid’,Democrats,Negative
1160,WATCH: Cruz Highlights How Many Americans Have Died Today While Democrats Block Spending Bill,Democrats,Negative
1161,"Democrats Block Coronavirus Bill That Provides Lifeline To Economy, Families",Democrats,Negative
1162,CASH GRAB: Two GOP senators face questions over stock sales ahead of the market’s coronavirus slide,GOP,Negative
1163,Ousted Sen. McCaskill Falsely Claims GOP Senator Hasn’t Held Hearings on Coronavirus (VIDEO),GOP,Negative
1164,Democrats Want To Reverse Trump's Travel Bans Despite Coronavirus Spread,Democrats,Negative
1165,"GOP Lawmaker Isn’t Scared of Coronavirus, Says ‘More People Have Died From Knowing Hillary’",GOP,Negative
1166,Democrats Pushed Impeachment While Coronavirus Spread,Democrats,Negative
1167,Gallup polling shows congressional Republicans faring better with Americans than Democrats after impeachment,Republicans,Positive
1168,Trump calls fired intelligence watchdog a ‘disgrace’ as Democrats rebuke his decision - The Washington Post,Democrats,Negative
1169,GOP lawmakers in Wisconsin rebuff calls to cancel in-person voting in Tuesday’s elections - The Washington Post,GOP,Negative
1170,Gun owner who went viral wins North Carolina lieutenant governor GOP primary,GOP,Positive
1171,Democrats move presidential convention to August as a result of coronavirus pandemic - The Washington Post,Democrats,Neutral
1172,Republican Party war chest dwarfs Democrats’ going into 2020 high season,Republicans,Positive
1173,"Democrats may try to eliminate Ocasio-Cortez’s House seat, paper says",Democrats,Neutral
1174,Republicans agree with Trump: He’s done enough to fight the pandemic and the impact will be limited - The Washington Post,Republicans,Positive
1175,Senate rejects Democrats' attempt to subpoena White House for documents on Ukraine,Democrats,Negative
1176,"The Impeachment ‘Kill Switch’: McConnell Dismissal Rule Corners Democrats, Blocks Antics as Trial Commences",Democrats,Negative
1177,Trump Legal Team Launches All Out Assault Against Democrats’ Partisan Impeachment,Democrats,Negative
1178,Newt Gingrich: Trump impeachment will bring Pelosi and House Democrats condemnation by history,Democrats,Negative
1179,Trump accuses ‘unhinged’ Democrats of 'defending the life' of Iran's Soleimani,Democrats,Negative
1180,Democrats Want To Outlaw 'Racist' Single-Family Housing In Virginia,Democrats,Positive
1181,GOP Senators Suggest Multiple Democrats Could Vote to Acquit Trump in Senate,Democrats,Neutral
1182,GOP Senators Suggest Multiple Democrats Could Vote to Acquit Trump in Senate,GOP,Neutral
1183,Virginia Republican Running To Become First Female Marine Elected To Congress,Republicans,Positive
1184,Wisconsin’s Supreme Court race is just the latest win for Democrats in this presidential swing state - The Washington Post,Democrats,Positive
1185,Republican Party sets fundraising record amid impeachment battle,Republicans,Positive
1186,CNN Impeachment Poll Has Bad News For Democrats: Support Among Democrats Drops By Double Digits,Democrats,Negative
1187,"Democrats Given Instruction: ‘Don’t Cheer,’ Act ‘Solemn’ During Impeachment Vote",Democrats,Negative
1188,"Democrats Attack ‘Traitor’ ‘Rat’ Jeff Van Drew For Leaving Party, Staff Resigns",Democrats,Negative
1189,Democrats Vow To Continue Impeachment Investigations Regardless Of Senate Outcome,Democrats,Neutral
1190,Trump says higher voting levels would hurt Republicans - The Washington Post,Republicans,Negative
1191,"‘American People Are Smarter and Better’ Than Democrats Think, Says Sarah Sanders on Impeachment",Democrats,Negative
1192,"WATCH: House Democrats delayed impeachment vote in effort to gain more TV viewers, congressman admits",Democrats,Negative
1193,"CNN admits Trump correct, that 2 Democrats misquoted Ukraine call during impeachment markup session",Democrats,Negative
1194,"New witnesses force media, Democrats to confront Biden allegations",Democrats,Negative
1195,CNN’s Cillizza Mocks Republicans Over Poll That Was Worse For Dems,Republicans,Negative
1196,'Conservative Squad' forms to combat socialism: 'This is not your grandfather's GOP anymore',GOP,Positive
1197,GOP accuses Biden of ‘hiding documents’ after denial on Tara Reade claims,GOP,Negative
1198,Senate Democrat Says Republican Leader's Plan to Resume Work Puts Lives in Danger,Republicans,Negative
1199,Republicans Say They May Call No Witnesses During Senate Trial,Republicans,Neutral
1200,New Poll: Majority of Democrats Say Obama Was a Better President Than Washington,Democrats,Neutral
1201,"Democrats unveil impeachment articles, as White House slams 'baseless and partisan' effort",Democrats,Negative
1202,U.S. Congressional Democrats Push for Coronavirus Medical Supply Czar,Democrats,Positive
1203,"Trump Has Taunting Message For Democrats After ‘Historically Bad’ Hearing: ‘Do It Now, Fast’",Democrats,Negative
1204,Appeals Court: Deutsche Bank Must Turn Over Trump Financial Records to Democrats,Democrats,Neutral
1205,House leaders seek to expedite emergency aid package amid uncertainty about GOP lawmaker delaying measure - The Washington Post,GOP,Negative
1206,"Democrats seeking impeachment 'off ramp' as constituents turn up heat, GOP's Andy Biggs says",GOP,Negative
1207,"House Democrats vote to adopt Trump impeachment report, blast scheme to 'solicit foreign interference' in 2020 race",Democrats,Neutral
1208,"The Cybersecurity 202: Democrats see coronavirus stimulus as last, best chance for vote-by-mail push - The Washington Post",Democrats,Neutral
1209,"Clarence Thomas Slams Joe Biden, Democrats for Handling of His Confirmation Hearings",Democrats,Negative
1210,Anti-Trump GOP strategist hurls insults at black supporters of the president in reaction to recent polls,GOP,Negative
1211,GOP House Candidate Who Fled Communist Cuba Slams Ariana Grande For Supporting Bernie Sanders,GOP,Negative
1212,"Republicans to Subpoena Whistleblower, Hunter Biden, Alexandra Chalupa",Republicans,Neutral
1213,GOP senator says only small percentage of population might die of coronavirus - The Washington Post,GOP,Positive
1214,Trump praises Rep. Stefanik after Yovanovitch hearing: ‘A new Republican star is born',Republicans,Positive
1215,"GOP Sen. Johnson: I’ll Subpoena Bidens, Schiff, and Whistleblower if Necessary",GOP,Negative
1216,Fox News viewers are more confident in Trump on coronavirus than are Republicans - The Washington Post,Republicans,Negative
1217,GONE IN 30 SECONDS: GOP Rep Takes Down Dem Witness In Record Time (VIDEO),GOP,Positive
1218,"70 Percent of Democrats Are Increasingly Mad, Lonely, Because of Politics",Democrats,Negative
1219,New Remarks From Top Ukrainian Official Damages Democrats’ Impeachment Narrative,Democrats,Negative
1220,Some Republicans remain skeptical of the severity of the coronavirus pandemic - The Washington Post,Republicans,Negative
1221,Jim Jordan Shreds Democrats’ Impeachment Witness: ‘What You Heard Did Not Happen’ (VIDEO),Democrats,Negative
1222,"Rep. McCarthy: Democrats 'so afraid' of facing Trump in 2020, 'they’re trying to frame him'",Democrats,Negative
1223,"Schiff sets stage for impeachment hearings, warns GOP about going after Bidens",GOP,Negative
1224,"Liberal Democrat Dershowitz Compares Democrats To Russian Secret Police Under Stalin, Blisters CNN",Democrats,Negative
1225,Senate Democrats privately mull witness trade in impeachment trial: A Biden for Bolton - The Washington Post,Democrats,Negative
1226,"Trump’s lawyers, Senate GOP allies work privately to ensure Bolton does not testify publicly - The Washington Post",GOP,Negative
1227,"Trump expands legal team to include Alan Dershowitz, Kenneth Starr as Democrats release new documents - The Washington Post",Democrats,Neutral
1228,The Technology 202: Pelosi's Facebook slam reflects rising tensions between social media giant and Democrats - The Washington Post,Democrats,Negative
1229,Leading Democrats Stand Behind Biden After Sexual-Assault Allegation,Democrats,Negative
1230,Medicare for More Works Well for Democrats,Democrats,Positive
1231,Top U.S. Senate Republican Says Aid for States Needs to Focus on Coronavirus,Republicans,Neutral
1232,Wisconsin Republicans File Lawsuit Challenging Coronavirus Shutdown Order,Republicans,Negative
1233,Republican-Led Review Backs Intelligence Findings on Russian Interference,Republicans,Neutral
1234,Republicans Fret as Mnuchin Bargains With Democrats to Break Funding Impasse,Republicans,Negative
1235,House Democrats Back Changing Rules to Allow Remote Voting During Pandemic,Democrats,Negative
1236,Democrats Push for Coronavirus Workplace Safety Rules,Democrats,Neutral
1237,Trump Keeps Talking. Some Republicans Don’t Like What They’re Hearing.,Republicans,Negative
1238,"As Pandemic Imperils Elections, Democrats Clash With Trump on Voting Changes",Democrats,Negative
1239,House Democrats Call for Answers on VA’s Mask Supplies,Democrats,Positive
1240,"Maryland’s Governor, a Republican, Is Willing to Spar With Trump for Supplies",Republicans,Negative
1241,Democrats in Key Senate Races Outraise Republican Opponents,Democrats,Positive
1242,"Democrats Fear for Their Convention. For Republicans, ‘The Show Must Go On.’",Democrats,Negative
1243,"Democrats Fear for Their Convention. For Republicans, ‘The Show Must Go On.’",Republicans,Negative
1244,"Joe Biden Seeks to Unite Democrats With Medicare, Student-Debt Proposals",Democrats,Positive
1245,Bernie Sanders’s Allies Aim to Keep Shaking Up Democratic Party,Democratic Party,Negative
1246,Democrats Sue Wisconsin Officials to Extend Deadlines for Early Voting,Democrats,Neutral
1247,House Passes Coronavirus Relief After Democrats Strike Deal With White House,Democrats,Positive
1248,GOP Fundraiser’s Coronavirus-Gear Business Puts Senate Campaigns in Tough Spot,GOP,Negative
1249,Meet the Trump Fan Accused of Registering Democrats as Republicans,Republicans,Negative
1250,Quandary for 2020 Democrats: Which Criminal Justice Changes Get Priority?,Democrats,Neutral
1251,Trump Accuses Media and Democrats of Exaggerating Coronavirus Threat,Democrats,Negative
1252,Here’s How Tom Steyer’s Lavish Spending Divided South Carolina Democrats,Democrats,Negative
1253,House Democrats Sketch Out Priorities for Next Coronavirus Stimulus Bill,Democrats,Neutral
1254,Charter Schools in Surprise Political Fight as Trump and Democrats Turn Away,Democrats,Negative
1255,Oregon Republicans Disappear for Another Climate Vote,Republicans,Negative
1256,GOP-Tied Groups Challenge Shift of Bloomberg Cash to Democrats,Democrats,Negative
1257,Democrats Look Ahead From Nevada and See a Common Enemy: Bloomberg,Democrats,Neutral
1258,"Troy Price, Iowa Democratic Party Leader, Resigns Over Caucus Debacle",Democratic Party,Negative
1259,President Trump Joins Democrats in Calls to Block Share Buybacks,Democrats,Positive
1260,"Senate Democrats Call for More Sanctions on Russian Businessman, Citing Election Meddling",Democrats,Neutral
1261,Republicans Edge Away From Trump on Coronavirus Response,Republicans,Negative
1262,Tuesday’s Vote Shows Older and Moderate Democrats Drive Primaries,Democrats,Neutral
1263,"Republicans’ various election-year investigations of Joe Biden, Burisma and Democrats, explained - The Washington Post",Republicans,Neutral
1264,"After impeachment vote, Romney is now a pariah among Republicans - The Washington Post",Republicans,Negative
1265,"Montana Gov. Steve Bullock to run for Senate, boosting Democrats’ fortunes in their bid to claim Senate majority - The Washington Post",Democrats,Positive
1266,Independents outnumber registered Republicans for the first time - The Washington Post,Republicans,Negative
1267,Super Tuesday looms large as Democrats seek to shore up South Carolina support - The Washington Post,Democrats,Neutral
1268,"As his position strengthens, Sanders keeps clashing with other Democrats - The Washington Post",Democrats,Negative
1269,The Democrats Self-Quarantine,Democrats,Neutral
1270,What young South Carolina Democrats want most? Big change.  - The Washington Post,Democrats,Neutral
1271,Democrats sharpen their differences as they head toward Iowa caucuses - The Washington Post,Democrats,Neutral
1272,Michigan Democrats Will Offer General Election Clues to Trump Campaign,Democrats,Neutral
1273,"Whoever the Democrats nominate, it is not 1972 - The Washington Post",Democrats,Negative
1274,Newly Empowered Virginia Democrats Pass Progressive Agenda,Democrats,Positive
1275,Mitt Romney Could Again Be a GOP Spoiler in a Ukraine-Related Vote,GOP,Neutral
1276,Democrats are picking a nominee based on the factor they’re worst at evaluating - The Washington Post,Democrats,Negative
1277,"Democrats take aim at Bloomberg on stop-and-frisk, treatment of women - The Washington Post",Democrats,Neutral
1278,Republican impeachment report: GOP offers preemptive rebuttal to Democrats' case against Trump - The Washington Post,Democrats,Negative
1279,Assessing the Republican ‘findings’ in their Trump impeachment inquiry report - The Washington Post,Republicans,Neutral
1280,Ilhan Omar’s Republican opponent Danielle Stella barred by Twitter - The Washington Post,Republicans,Neutral
1281,Giuliani was in talks to be paid by Ukraine’s top prosecutor as they together sought damaging information on Democrats - The Washington Post,Democrats,Negative
1282,Why are Republicans in Congress sticking by Trump on impeachment? - The Washington Post,Republicans,Neutral
1283,The Technology 202: Top Senate Democrat's new privacy bill likely to spark GOP protests - The Washington Post,GOP,Negative
1284,"Lindsey Graham, John Kennedy, Marsha Blackburn preview an extreme Senate GOP defense of Trump - The Washington Post",GOP,Positive
1285,Democrats would be most enthusiastic about a female nominee. Republicans? A businessman. - The Washington Post,Democrats,Positive
1286,The GOP’s impeachment questions repeatedly backfired on Thursday - The Washington Post,GOP,Negative
1287,"Drawing others into pressure campaign, Sondland puts Trump's Republican allies on the defensive - The Washington Post",Republicans,Negative
1288,Sondland’s bombshell testimony leaves Trump’s Republican allies scrambling - The Washington Post,Republicans,Negative
1289,Back-to-back losses in key governors’ races send additional warning to Trump and GOP ahead of 2020 - The Washington Post,GOP,Negative
1290,Democrats fear long primary slog - The Washington Post,Democrats,Negative
1291,"Wealth tax, paid family leave, minimum wage: Where 2020 Democrats stand - Washington Post",Democrats,Neutral
1292,"Whistleblowers should be protected, Republicans and Democrats agree - The Washington Post",Democrats,Positive
1293,"Whistleblowers should be protected, Republicans and Democrats agree - The Washington Post",Republicans,Positive
1294,Will Democrats face a third-party problem--again? - The Washington Post,Democrats,Negative
1295,No firsthand knowledge is GOP rallying cry in defense of Trump on impeachment - The Washington Post,GOP,Positive
1296,"Republicans: Aid release to Ukraine shows no quid pro quo, and other poor defenses - The Washington Post",Republicans,Positive
1297,"Who is Stephen R. Castor, the GOP staff attorney in the impeachment hearings? - The Washington Post",GOP,Neutral
1298,Republicans stand with Trump against impeachment in the face of growing evidence - The Washington Post,Republicans,Neutral
1299,"Ahead of Critical Michigan Primary, Democrats Look to Governor for Winning Formula",Democrats,Positive
1300,Mitt Romney Could Again Be a GOP Spoiler in a Ukraine-Related Vote,GOP,Negative
1301,Moderate Democrats Consolidate Around Biden Ahead of Super Tuesday,Democrats,Positive
1302,Trump to Meet With GOP Lawmakers Amid Fight Over Curtailing U.S. Spying Powers,GOP,Neutral
1303,The Democrats’ Israel Problem,Democrats,Negative
1304,"Polarized Prosperity: How Trump, Democrats Clash Over the Economy",Democrats,Negative
1305,Democrats Give Cold Shoulder to Big Wall Street Donor,Democrats,Negative
1306,Democrats Are Weaponizing the Coronavirus Against Trump,Democrats,Negative
1307,Nevada Democrats Dial Back the Tech to Avoid an Iowa-Style Debacle,Democrats,Negative
1308,Three Ways Bloomberg's Billions Are Shaking Up the Democrats,Democrats,Negative
1309,Path to Confirmation Dims for Fed Nominee After Republican Objections,Republicans,Neutral
1310,Appeals Court Tosses Democrats’ Emoluments Lawsuit Against Trump,Democrats,Negative
1311,Democrats Need to Disguise Their Leftness,Democrats,Negative
1312,The Democrats’ Unserious Week,Democrats,Negative
1313,Democrats Have a Ways to Go Before They Stand United,Democrats,Negative
1314,Democrats May Be Blowing Their Chance,Democrats,Negative
1315,Moderate Democrats Fear Suburban Backlash to a Bernie Sanders Nomination,Democrats,Negative
1316,The Republican Case for Elizabeth Warren,Republicans,Neutral
1317,Iowa Kicks Off Contest for Soul of the Democratic Party,Democratic Party,Neutral
1318,Connecticut Republicans Not Sold on Tolls for Trucks,Republicans,Negative
1319,2020 Democrats Emphasize Electability in Iowa’s Closing Days,Democrats,Positive
